edid-decode (hex):

00 ff ff ff ff ff ff 00 08 4b 01 0b e9 03 00 00
2e 13 01 03 80 46 27 78 0a 19 90 a7 55 46 98 24
10 49 4b 21 08 00 8b c0 81 40 81 c0 61 40 01 01
01 01 01 01 01 01 01 1d 00 72 51 d0 1e 20 6e 28
55 00 c4 8e 21 00 00 1e 01 1d 80 18 71 1c 16 20
58 2c 25 00 c4 8e 21 00 00 9e 00 00 00 fc 00 42
42 4b 20 54 56 20 20 20 20 20 0a 20 00 00 00 fd
00 16 50 0e 5b 10 00 0a 20 20 20 20 20 20 01 f9

02 03 20 f2 4a 01 02 03 84 05 10 12 93 14 1f 26
11 07 00 15 07 50 83 01 00 00 65 03 0c 00 10 00
8c 0a d0 8a 20 e0 2d 10 10 3e 96 00 13 8e 21 00
00 18 01 1d 00 bc 52 d0 1e 20 b8 28 55 40 c4 8e
21 00 00 1e 01 1d 80 d0 72 1c 16 20 10 2c 25 80
c4 8e 21 00 00 9e 8c 0a d0 8a 20 e0 2d 10 10 3e
96 00 c4 8e 21 00 00 18 8c 0a d0 90 20 40 31 20
0c 40 55 00 c4 8e 21 00 00 18 00 00 00 00 00 b8

----------------

Block 0, Base EDID:
  EDID Structure Version & Revision: 1.3
  Vendor & Product Identification:
    Manufacturer: BBK
    Model: 2817
    Serial Number: 1001
    Made in: week 46 of 2009
  Basic Display Parameters & Features:
    Digital display
    Maximum image size: 70 cm x 39 cm
    Gamma: 2.20
    RGB color display
    First detailed timing is the preferred timing
  Color Characteristics:
    Red  : 0.6523, 0.3330
    Green: 0.2753, 0.5947
    Blue : 0.1425, 0.0634
    White: 0.2851, 0.2929
  Established Timings I & II:
    DMT 0x04:   640x480    59.940476 Hz   4:3     31.469 kHz     25.175000 MHz
    DMT 0x09:   800x600    60.316541 Hz   4:3     37.879 kHz     40.000000 MHz
    DMT 0x10:  1024x768    60.003840 Hz   4:3     48.363 kHz     65.000000 MHz
  Standard Timings:
    GTF     :  1360x765    60.000341 Hz  16:9     47.520 kHz     84.396000 MHz
    DMT 0x20:  1280x960    60.000000 Hz   4:3     60.000 kHz    108.000000 MHz
    DMT 0x55:  1280x720    60.000000 Hz  16:9     45.000 kHz     74.250000 MHz
    DMT 0x10:  1024x768    60.003840 Hz   4:3     48.363 kHz     65.000000 MHz
  Detailed Timing Descriptors:
    DTD 1:  1280x720    60.000000 Hz  16:9     45.000 kHz     74.250000 MHz (708 mm x 398 mm)
                 Hfront  110 Hsync  40 Hback  220 Hpol P
                 Vfront    5 Vsync   5 Vback   20 Vpol P
    DTD 2:  1920x1080i  60.000000 Hz  16:9     33.750 kHz     74.250000 MHz (708 mm x 398 mm)
                 Hfront   88 Hsync  44 Hback  148 Hpol P
                 Vfront    2 Vsync   5 Vback   15 Vpol P Vfront +0.5 Odd Field
                 Vfront    2 Vsync   5 Vback   15 Vpol P Vback  +0.5 Even Field
    Display Product Name: 'BBK TV     '
    Display Range Limits:
      Monitor ranges (GTF): 22-80 Hz V, 14-91 kHz H, max dotclock 160 MHz
  Extension blocks: 1
Checksum: 0xf9

----------------

Block 1, CTA-861 Extension Block:
  Revision: 3
  Underscans IT Video Formats by default
  Basic audio support
  Supports YCbCr 4:4:4
  Supports YCbCr 4:2:2
  Native detailed modes: 2
  Video Data Block:
    VIC   1:   640x480    59.940476 Hz   4:3     31.469 kHz     25.175000 MHz
    VIC   2:   720x480    59.940060 Hz   4:3     31.469 kHz     27.000000 MHz
    VIC   3:   720x480    59.940060 Hz  16:9     31.469 kHz     27.000000 MHz
    VIC   4:  1280x720    60.000000 Hz  16:9     45.000 kHz     74.250000 MHz (native)
    VIC   5:  1920x1080i  60.000000 Hz  16:9     33.750 kHz     74.250000 MHz
    VIC  16:  1920x1080   60.000000 Hz  16:9     67.500 kHz    148.500000 MHz
    VIC  18:   720x576    50.000000 Hz  16:9     31.250 kHz     27.000000 MHz
    VIC  19:  1280x720    50.000000 Hz  16:9     37.500 kHz     74.250000 MHz (native)
    VIC  20:  1920x1080i  50.000000 Hz  16:9     28.125 kHz     74.250000 MHz
    VIC  31:  1920x1080   50.000000 Hz  16:9     56.250 kHz    148.500000 MHz
  Audio Data Block:
    AC-3:
      Max channels: 2
      Supported sample rates (kHz): 48 44.1 32
      Maximum bit rate: 0 kb/s
    AC-3:
      Max channels: 6
      Supported sample rates (kHz): 48 44.1 32
      Maximum bit rate: 640 kb/s
  Speaker Allocation Data Block:
    FL/FR - Front Left/Right
  Vendor-Specific Data Block (HDMI), OUI 00-0C-03:
    Source physical address: 1.0.0.0
  Detailed Timing Descriptors:
    DTD 3:   720x480    59.940060 Hz   3:2     31.469 kHz     27.000000 MHz (531 mm x 398 mm)
                 Hfront   16 Hsync  62 Hback   60 Hpol N
                 Vfront    9 Vsync   6 Vback   30 Vpol N
    DTD 4:  1280x720    50.000000 Hz  16:9     37.500 kHz     74.250000 MHz (708 mm x 398 mm)
                 Hfront  440 Hsync  40 Hback  220 Hpol P
                 Vfront    5 Vsync   5 Vback   20 Vpol P
    DTD 5:  1920x1080i  50.000000 Hz  16:9     28.125 kHz     74.250000 MHz (708 mm x 398 mm)
                 Hfront  528 Hsync  44 Hback  148 Hpol P
                 Vfront    2 Vsync   5 Vback   15 Vpol P Vfront +0.5 Odd Field
                 Vfront    2 Vsync   5 Vback   15 Vpol P Vback  +0.5 Even Field
    DTD 6:   720x480    59.940060 Hz   3:2     31.469 kHz     27.000000 MHz (708 mm x 398 mm)
                 Hfront   16 Hsync  62 Hback   60 Hpol N
                 Vfront    9 Vsync   6 Vback   30 Vpol N
    DTD 7:   720x576    50.000000 Hz   5:4     31.250 kHz     27.000000 MHz (708 mm x 398 mm)
                 Hfront   12 Hsync  64 Hback   68 Hpol N
                 Vfront    5 Vsync   5 Vback   39 Vpol N
Checksum: 0xb8  Unused space in Extension Block: 5 bytes
